<?xml version="1.0" encoding="UTF-8"?>
<!DOCTYPE restaurante SYSTEM "carta.dtd">
<restaurante>
    <menus>
        <primeros_platos>
            <primer_plato>
                <id_primer>1</id_primer>
                <Nombre_primer>Mojarra</Nombre_primer>
                <precio_primer>35000</precio_primer>
                <observaciones_primer>Mojarra frita con ensalada y papa frita</observaciones_primer>
                <avisos_primer>la ensalada incluye oregano abstenerse si es alergico</avisos_primer>
            </primer_plato>
        </primeros_platos>
        <segundos_platos>
            <segundo_plato>
                <id_segundo>1</id_segundo>
                <Nombre_segundo>Carne en salsa</Nombre_segundo>
                <precio_segundo>37000</precio_segundo>
                <observaciones_segundo>Carne en salsa con arroz y papa criolla</observaciones_segundo>
                <avisos_segundo>el arroz incluye tomillo abstenerse si es alergico</avisos_segundo>
            </segundo_plato>
        </segundos_platos>
        <terceros_platos>
            <tercer_plato>
                <id_tercero>1</id_tercero>
                <Nombre_tercero>Carne en salsa</Nombre_tercero>
                <precio_tercero>37000</precio_tercero>
                <observaciones_tercero>Carne en salsa con arroz y papa criolla</observaciones_tercero>
                <avisos_tercero>el arroz incluye tomillo abstenerse si es alergico</avisos_tercero>
            </tercer_plato>
        </terceros_platos>
    </menus>
</restaurante>